<?xml version="1.0" encoding="UTF-8"?>
<xs:schema xmlns:xs="http://www.w3.org/2001/XMLSchema" xmlns="http://www.oecd.org/TOCS" xmlns:cbc="http://www.oecd.org/GHSTS/CommonBasicComponent-1" targetNamespace="http://www.oecd.org/TOCS" elementFormDefault="qualified" attributeFormDefault="unqualified" version="01.04.00">
	<xs:include schemaLocation="ghsts-toc-picklists.xsd"/>
	<xs:import namespace="http://www.oecd.org/GHSTS/CommonBasicComponent-1" schemaLocation="./ghsts-CommonBasicComponents_01-04-00.xsd"/>
	<xs:element name="TOC">
		<xs:annotation>
			<xs:documentation>A dossier structure (Table of Content = TOC), which should be published</xs:documentation>
		</xs:annotation>
		<xs:complexType>
			<xs:sequence>
				<xs:element name="TOC_SHORT_NAME" type="cbc:string20">
					<xs:annotation>
						<xs:documentation>Wordwide unique short name to identify this TOC </xs:documentation>
					</xs:annotation>
				</xs:element>
				<xs:element name="TOC_PID" type="cbc:PIDType">
					<xs:annotation>
						<xs:documentation>Wordwide unique identifier of the Table of Contents</xs:documentation>
					</xs:annotation>
				</xs:element>
				<xs:element name="TOC_OWNER">
					<xs:annotation>
						<xs:documentation>The owner has the responsibility for this ToC</xs:documentation>
					</xs:annotation>
					<xs:complexType>
						<xs:sequence>
							<xs:element name="VALUE" type="EXTENSION_TYPE_TOC_OWNER">
								<xs:annotation>
									<xs:documentation>Code according restricted picklist TYPE_TOC_OWNER; other values are submitted via attribute 'Other_Value'</xs:documentation>
								</xs:annotation>
							</xs:element>
							<xs:element name="VALUE_DECODE" type="cbc:string255">
								<xs:annotation>
									<xs:documentation>Long text of 'Value' or 'Other_Value'</xs:documentation>
								</xs:annotation>
							</xs:element>
						</xs:sequence>
					</xs:complexType>
				</xs:element>
				<xs:element name="TOC_FULL_NAME" type="cbc:string255">
					<xs:annotation>
						<xs:documentation>Full Name for the TOC (Dossier-Structure)</xs:documentation>
					</xs:annotation>
				</xs:element>
				<xs:element name="TOC_VERSION" type="cbc:versionnumberType">
					<xs:annotation>
						<xs:documentation>TOC Version</xs:documentation>
					</xs:annotation>
				</xs:element>
				<xs:element name="TO_USE_FROM" type="xs:date">
					<xs:annotation>
						<xs:documentation>This TOC is valid from ...(default= publishing date)</xs:documentation>
					</xs:annotation>
				</xs:element>
				<xs:element name="TO_USE_UNTIL" type="xs:date" minOccurs="0">
					<xs:annotation>
						<xs:documentation>This TOC was valid until ...</xs:documentation>
					</xs:annotation>
				</xs:element>
				<xs:element name="STRUCTURE">
					<xs:complexType>
						<xs:sequence maxOccurs="unbounded">
							<xs:element name="TOC_NODE" type="TYPE_TOC_NODE"/>
						</xs:sequence>
					</xs:complexType>
				</xs:element>
			</xs:sequence>
		</xs:complexType>
	</xs:element>
	<xs:element name="TOC_NODE" type="TYPE_TOC_NODE">
		<xs:annotation>
			<xs:documentation>TOC-Nodes (Annex Points) in sequence of their usage in the Dossier</xs:documentation>
		</xs:annotation>
		<xs:key name="TocNodePID">
			<xs:selector xpath="."/>
			<xs:field xpath="TOC_NODE_PID"/>
		</xs:key>
	</xs:element>
	<xs:complexType name="TYPE_TOC_NODE">
		<xs:annotation>
			<xs:documentation>A ToC has a lot of TOC-Nodes, identified by unique TOC NODE NAME and PID</xs:documentation>
		</xs:annotation>
		<xs:sequence>
			<xs:element name="NODE_NAME" type="cbc:string20">
				<xs:annotation>
					<xs:documentation>Unique String inside of the ToC</xs:documentation>
				</xs:annotation>
			</xs:element>
			<xs:element name="NODE_HEADING" type="cbc:string255">
				<xs:annotation>
					<xs:documentation>Heading text </xs:documentation>
				</xs:annotation>
			</xs:element>
			<xs:element name="DOCUMENT_REFERENCES" type="xs:boolean"/>
			<xs:element name="LOGICAL_DELETED" type="xs:boolean"/>
			<xs:element name="TOC_NODE_PID" type="cbc:PIDType">
				<xs:annotation>
					<xs:documentation>World wide unique identifier for TOC Nodes. This PID should be the basis for cross references between different TOC's </xs:documentation>
				</xs:annotation>
			</xs:element>
			<xs:element name="TOC_NODE" type="TYPE_TOC_NODE" minOccurs="0" maxOccurs="unbounded"/>
		</xs:sequence>
	</xs:complexType>
</xs:schema>
